{
  "phase": "BREAKOUT_IMPULSE",
  "start": "2026-01-15T04:00:00Z",
  "end": "2026-01-15T12:00:00Z",
  "price_change": {
    "value": -2.1,
    "unit": "percent",
    "timestamp": "2026-01-15T12:00:00Z",
    "source": "fixture",
    "status": "DERIVED",
    "quality": "VALID",
    "derivation": "static golden fixture; not live market data",
    "version": "fixture-v1"
  },
  "volume": {
    "value": 1000000,
    "unit": "USDT",
    "timestamp": "2026-01-15T12:00:00Z",
    "source": "fixture",
    "status": "DERIVED",
    "quality": "VALID",
    "derivation": "static golden fixture; not live market data",
    "version": "fixture-v1"
  },
  "volume_ratio": {
    "value": 1.7,
    "unit": "ratio",
    "timestamp": "2026-01-15T12:00:00Z",
    "source": "fixture",
    "status": "DERIVED",
    "quality": "VALID",
    "derivation": "static golden fixture; not live market data",
    "version": "fixture-v1"
  },
  "cvd_delta": {
    "value": -480000,
    "unit": "USDT",
    "timestamp": "2026-01-15T12:00:00Z",
    "source": "fixture",
    "status": "DERIVED",
    "quality": "VALID",
    "derivation": "static golden fixture; not live market data",
    "version": "fixture-v1"
  },
  "oi_start": {
    "value": 1000000,
    "unit": "contracts",
    "timestamp": "2026-01-15T04:00:00Z",
    "source": "fixture",
    "status": "DERIVED",
    "quality": "VALID",
    "derivation": "static golden fixture; not live market data",
    "version": "fixture-v1"
  },
  "oi_end": {
    "value": 1070000,
    "unit": "contracts",
    "timestamp": "2026-01-15T12:00:00Z",
    "source": "fixture",
    "status": "DERIVED",
    "quality": "VALID",
    "derivation": "static golden fixture; not live market data",
    "version": "fixture-v1"
  },
  "oi_change": {
    "value": 7,
    "unit": "percent",
    "timestamp": "2026-01-15T12:00:00Z",
    "source": "fixture",
    "status": "DERIVED",
    "quality": "VALID",
    "derivation": "static golden fixture; not live market data",
    "version": "fixture-v1"
  },
  "liquidation": {
    "value": 300000,
    "unit": "USDT",
    "timestamp": "2026-01-15T12:00:00Z",
    "source": "fixture",
    "status": "DERIVED",
    "quality": "VALID",
    "derivation": "static golden fixture; not live market data",
    "version": "fixture-v1"
  },
  "funding": {
    "value": 0.005,
    "unit": "percent",
    "timestamp": "2026-01-15T12:00:00Z",
    "source": "fixture",
    "status": "DERIVED",
    "quality": "VALID",
    "derivation": "static golden fixture; not live market data",
    "version": "fixture-v1"
  },
  "basis": {
    "value": 0.08,
    "unit": "percent",
    "timestamp": "2026-01-15T12:00:00Z",
    "source": "fixture",
    "status": "DERIVED",
    "quality": "VALID",
    "derivation": "static golden fixture; not live market data",
    "version": "fixture-v1"
  },
  "data_quality": {
    "overall": "VALID",
    "gaps": [],
    "stale_sources": [],
    "missing_sources": [],
    "watermark_mismatches": []
  },
  "gap_flags": [],
  "cross_gap_change": false,
  "primary_classification": "NEW_SHORTS_DOMINANT",
  "alternative_classification": "MIXED_POSITIONING",
  "confidence": "MEDIUM",
  "evidence": [
    {
      "claim": "classification is grounded by price, CVD and OI paths",
      "evidence_paths": [
        "/order_flow_phases/0/price_change"
      ]
    }
  ],
  "counterevidence": [
    {
      "claim": "the available signals do not isolate every venue participant",
      "evidence_paths": [
        "/data_quality"
      ]
    }
  ]
}
